{
 "schema": "cpb-horizon-tracker-archive-v3",
 "horizon": "H000",
 "title": "Poker Night Tracker Archive",
 "meta": {
  "purpose": "Append-only evidence archive for nodes and edges rolled out of the active horizon tracker."
 },
 "status_vocabulary": {
  "done": {
   "glyph": "✅",
   "meaning": "Merged-review evidence recorded or explicit none-by-policy waiver"
  },
  "historical": {
   "glyph": "⚪",
   "meaning": "Historical and non-executable"
  }
 },
 "rolled_nodes": [],
 "rolled_edges": [],
 "change_log": [
  {
   "date": "2026-09-25",
   "entry": "Archive initialized at horizon admission."
  }
 ]
}
